[
  {
    "jobId": "job-0001-4aaa-8001-000000000001",
    "templateId": "tmpl-0001-4aaa-8001-000000000001",
    "deviceIds": ["d1a2b3c4-0001-4abc-8001-aabbccddeeff"],
    "parameters": { "radioChannel": 40, "txPowerDbm": 18 },
    "status": "completed",
    "protocol": "NETCONF",
    "approvedBy": "admin",
    "createdBy": "operator1",
    "scheduledAt": null,
    "startedAt": "2024-01-15T10:05:00Z",
    "completedAt": "2024-01-15T10:06:32Z",
    "ttlExpiry": "2024-01-18T10:00:00Z",
    "createdAt": "2024-01-15T10:00:00Z"
  },
  {
    "jobId": "job-0002-4aaa-8002-000000000002",
    "templateId": "tmpl-0002-4aaa-8002-000000000002",
    "deviceIds": ["d1a2b3c4-0002-4abc-8002-aabbccddeeff"],
    "parameters": {},
    "status": "queued",
    "protocol": "TR-069",
    "approvedBy": null,
    "createdBy": "operator2",
    "scheduledAt": "2024-01-16T02:00:00Z",
    "startedAt": null,
    "completedAt": null,
    "ttlExpiry": "2024-01-19T02:00:00Z",
    "createdAt": "2024-01-15T15:00:00Z"
  },
  {
    "jobId": "job-0003-4aaa-8003-000000000003",
    "templateId": "tmpl-0003-4aaa-8003-000000000003",
    "deviceIds": ["d1a2b3c4-0003-4abc-8003-aabbccddeeff"],
    "parameters": { "frequency": 5780 },
    "status": "failed",
    "protocol": "CLI",
    "approvedBy": "admin",
    "createdBy": "admin",
    "scheduledAt": null,
    "startedAt": "2024-01-14T11:00:00Z",
    "completedAt": "2024-01-14T11:01:05Z",
    "ttlExpiry": "2024-01-17T11:00:00Z",
    "createdAt": "2024-01-14T10:55:00Z"
  }
]
